Device,Question EN,Answer EN (truncated)
"GoPro Hero 13 Black","SDカードはどのくらいの頻度で交換すべきですか？","<b>高品質なV30 microSDカードは、通常の使用で3〜5年持ちます。</b> 重要な映像の消失を防ぐため、<b>エラーメッセージ、ファイルの破損、または書き込み拒否が発生した場合は、直ちにカー..."
"GoPro Hero 12 Black","V20カードで5K録画できますか？","<b>V20カードでの5.3Kビデオ録画は推奨されません。</b> V20カードでも録画できる場合がありますが、保証される書き込み速度は20MB/秒であり、安定した5.3K録画には不十分です。<b>V..."
"DJI Mini 4 Pro","DJI Mini 4 ProでV20カードを使用できますか？","<b>DJI Mini 4 ProでのV20カードの使用は推奨されません。</b> 特に高フレームレートにおいて、コマ落ちやファイル破損を防ぐため、<b>安定した4Kビデオ録画にはV30スピードクラス..."
"Canon EOS R5","R5には2枚のカードが必要ですか？","<b>はい、Canon EOS R5はデュアルカードスロットを備えており、キヤノンは安全のために2枚のV60カードの使用を推奨しています。</b> <b>8Kビデオ撮影時、デュアルカードはバックアップ..."
"Canon EOS R5","V30カードで4K撮影はできますか？","<b>はい、4Kビデオ録画はV30スピードクラスのカードで問題なく動作します。</b> しかし、<b>8K録画には、はるかに高いビットレートとデータスループットの要求のため、最低でもV60スピードクラ..."
"Canon EOS R5","CFexpressとSDの違いは何ですか？","<b>CFexpress Type BカードはSD UHS-IIよりも大幅に高速で</b>、<b>8K RAWビデオ録画に最適です。</b> <b>SD UHS-II V60カードはより手頃で4K録画..."
"Sony α6700 (ILCE-6700)","V30で4K 60fpsは十分ですか？","<b>はい、V30スピードクラスは、Sony α6700での安定した4K 60fpsビデオに必要な最低30MB/秒の書き込み速度を提供します。</b> <b>プロや上級ユーザーは、重要な撮影時の予備性..."
"VIOFO A229 Duo","VIOFO A229にはどの容量を使用すべきですか？","<b>A229 Duoには128GBから256GBが推奨されます。</b> 128GBカードは、ループ上書きが始まる前に約10〜12時間のデュアルチャンネル録画を提供します。より長く保存したい場合は、..."
"Raspberry Pi 5 (ラズベリーパイ5)","Raspberry Pi 5にとって、V30とA2のどちらが重要ですか？","<b>A2定格の方が重要です。</b> 「V」定格（例：V30）は持続的なビデオ録画速度用ですが、「A」定格（アプリケーションパフォーマンスクラス）はOSが行うランダム読み書き操作用です。A2カードの..."
"Insta360 X4","X3と同じカードを使えますか？","<b>はい、X3で使用していたV30以上のmicroSDカードはX4でも問題なく動作します。</b> X4も同じV30の最低要件を持っていますが、8Kファイルは大きくなるため、PCへのオフロード速度が..."
"ASUS ROG Ally","ROG Allyには高速なUHS-IIカードを使うべきですか？","<b>はい、最高のパフォーマンスを求めるなら絶対にお勧めします。</b> ROG AllyのUHS-IIリーダーはカードの速度を最大限に活かし、ゲームのロード時間を短縮します。低速なUHS-Iカードも..."
"ASUS ROG Ally","ROG Allyに最適な容量は？","<b>512GBまたは1TBが多くのユーザーにとって最適解です。</b> 最新のPCゲームは非常に容量が大きいため、これくらいの容量があればストレージ管理に悩まされることなく、多くのAAAタイトルを保..."
"Sony α7 IV (ILCE-7M4)","Sony α7 IVにはCFexpress Type Aカードが必要ですか？","<b>いいえ、ほとんどの撮影には必須ではありません。</b> ほぼすべてのビデオモードでV60またはV90のSD UHS-IIカードで十分です。CFexpress Type Aは、激しい連写時のバッフ..."
"Insta360 X3","Insta360 X3でSanDisk Ultraカードを使えますか？","<b>推奨されません。</b> 一部のUltraカードはV10定格であり、X3には最低V30が必要です。低速なカードを使用すると、特に高解像度モードでの録画失敗につながる可能性があります。SanDis..."
"Blackmagic Pocket Cinema Camera 4K","BMPCC 4Kにはどのカードタイプを使うべきですか？","<b>使用するコーデックによります。</b> 最高画質のBlackmagic RAW設定（例：3:1）には<b>CFast 2.0カード</b>が必要です。より圧縮されたRAWフォーマットやほとんどの..."
"Fujifilm X100VI","X100VIにV90は必要ですか？","<b>すべての録画モードにおいてV60で十分です。</b> X100VIの最大ビットレートはV60の要件を超えないため、V90カードによる実用的なメリットはありません。V60カードのままでもカメラ内パ..."
"Nikon Z f","Z fにはV90カードが必要ですか？ V60で十分ですか？","<b>Nikon Z fでのほとんどの写真撮影と標準的な4Kビデオ録画には、通常V60カードで十分です。</b> ただし、4K 120fpsスローモーションや最高ビットレートのN-RAWビデオを撮影す..."
"DJI Mini 2 SE","Mini 2 SEでSanDisk Ultraカードは使えますか？","<b>推奨されません。</b> DJIは信頼性の高いビデオ録画のためにU3/V30スピードクラスを指定しています。SanDisk Ultra（U1）のような低速カードを使用すると、飛行中に録画が失敗し..."
"Fujifilm X-S20","Is there a backup card slot?","<b>No, the Fujifilm X-S20 has only a single SD UHS-II card slot</b>. <b>Make regular backup copies o..."
"GoPro Hero Max","Is V30 needed for 360 video?","<b>Yes, V30 speed class is required for 360-degree video recording</b>. <b>360 video mode has signif..."
"GoPro Hero Max","How much storage for 360 content?","<b>In 360 mode, a 128GB microSD card provides approximately 1.5 hours of recording time</b>. Storage..."
"DJI Mini 3 Pro","Can V20 cards work?","<b>V20 cards are not safe for DJI Mini 3 Pro's 4K recording</b>. <b>V30 minimum speed class is requi..."
"DJI Air 3S","Is V60 required for Air 3S?","<b>V30 speed class cards will function for basic 4K recording on the DJI Air 3S</b>. However, <b>V60..."
"DJI Mavic 3","Can I use V30 cards?","<b>V30 cards are sufficient for 4K recording on the DJI Mavic 3</b>. However, <b>for 8K Cine recordi..."
"Nikon Z9","Do I need two cards?","<b>Yes, the Nikon Z9 has dual card slots and using two cards is strongly recommended</b>. <b>Dual ca..."
"Nikon Z9","Are CFexpress and XQD compatible?","<b>No, CFexpress Type B and XQD cards are not compatible</b>. <b>The Nikon Z9 supports both formats ..."
"Nintendo Switch Lite","Is the SD card slot different on the Switch Lite?","<b>No, the SD card slot and its speed capabilities are identical</b> to the standard Nintendo Switch..."
"Samsung Galaxy Tab S9","Can I install apps on the SD card on the Tab S9?","<b>Yes, Android allows some apps to be moved to the SD card</b> to free up internal storage. However..."
"Canon EOS R6 Mark II","Do I need two cards for the R6 Mark II?","<b>It is highly recommended for professional work.</b> Using both slots allows for instant backup, o..."
"Canon EOS R6 Mark II","Is V60 enough, or do I need V90?","<b>For video: V60 is sufficient.</b> <b>For burst shooting: V90 is recommended.</b> If you shoot bot..."
"Nextbase 622GW","Does the Nextbase 622GW come with an SD card?","<b>No, SD cards are sold separately.</b> Nextbase strongly recommends purchasing a High Endurance ca..."
"Nextbase 622GW","What's the best capacity for 4K recording?","<b>128GB is the sweet spot for most users.</b> A 128GB High Endurance card stores approximately 6-8 ..."
"DJI Air 3","Is V30 truly the minimum for DJI Air 3?","<b>Yes, V30 is the official minimum recommendation.</b> Using slower cards risks dropped frames and ..."
"Blackmagic Pocket Cinema Camera 6K Pro","Do I need CFast for the BMPCC 6K Pro?","<b>For full 6K RAW recording, yes.</b> CFast 2.0 is essential for the highest bitrate 6K RAW codecs...."
"Nikon Z8","Which card slot should I use on the Nikon Z8?","<b>Use the CFexpress slot for maximum performance</b>, especially for 8K video or long bursts of hig..."
"Panasonic Lumix S1H","Is V90 truly required for the S1H?","<b>Yes, V90 is essential for 6K and other high-bitrate recording modes.</b> While V60 cards may work..."
"GoPro Hero 11 Black","Are Hero 11 and Hero 12 card requirements the same?","<b>Yes, both require V30 microSD cards.</b> The Hero 11 Black has very similar video specifications ..."
"Amazon Fire HD 10","Can I move apps to the SD card on Fire HD 10?","<b>Yes, you can move compatible apps to the microSD card</b> through Settings > Storage to free up i..."
"Amazon Fire HD 10","What's the best capacity for a Fire HD 10?","<b>128GB to 256GB is the sweet spot for most users.</b> This provides ample space for offline videos..."
"Amazon Fire Max 11","Is the Fire Max 11 better for SD cards than Fire HD 10?","<b>Both tablets have identical microSD support (up to 1TB)</b>. The Max 11 has a larger screen and b..."
"Wyze Cam v3","Do I need a special SD card for security cameras?","<b>Yes, always use a High Endurance microSD card for security cameras.</b> Non-endurance cards are n..."
"Wyze Cam v3","What capacity should I get for continuous recording?","<b>64GB to 128GB is ideal for most users.</b> A 64GB card stores approximately 1-2 weeks of continuo..."
"Eufy Security SoloCam S340","How much video can a 128GB card hold?","<b>A 128GB High Endurance card stores approximately 2-3 weeks of continuous recording</b> on standar..."
"HP Chromebook 14","Can I install apps on the SD card in a Chromebook?","<b>ChromeOS does not allow installing Android apps directly to SD cards.</b> However, you can use th..."
"HP Chromebook 14","What's the best SD card capacity for students?","<b>64GB to 128GB is ideal for most students.</b> This provides ample space for offline Google Drive ..."
"DJI Osmo Action 4","Action 4 vs GoPro Hero 12 - same cards?","<b>Yes, both the DJI Osmo Action 4 and GoPro Hero 12 require V30 microSD cards.</b> Card requirement..."
"DJI Osmo Action 4","Does the magnetic mount affect the SD card?","<b>No, the magnetic quick-release mount does not affect microSD card data or performance.</b> The ca..."
"Nintendo 3DS / New 3DS XL","Can I use a 64GB or 128GB card even though Nintendo says 32GB max?","<b>Yes, but you must format it to FAT32 first.</b> SDXC cards (64GB+) come formatted as exFAT, which..."
"Nintendo 3DS / New 3DS XL","Do I need a microSD card or full-size SD?","<b>Original 3DS and 3DS XL models use full-size SD cards.</b> <b>New Nintendo 3DS and New Nintendo 3..."
"Anbernic RG353V","Do I really need two separate SD cards?","<b>Yes, the Anbernic RG353V has two physically separate microSD slots.</b> Slot 1 (often labeled 'TF..."
"Anbernic RG353V","What's the best capacity split between the two cards?","An ideal setup is a <b>32-64GB A2-rated card for the OS</b> and a <b>256GB-512GB U1-rated card for g..."
"ASUS ROG Ally X","Is the Ally X faster than the original Ally for SD cards?","<b>Yes, the Ally X has an improved and more reliable SD card reader that supports UHS-II speeds, add..."
"ASUS ROG Ally X","Do I really need a UHS-II card, or is UHS-I fine?","<b>UHS-II makes a significant difference on the Ally X.</b> Game load times can be 30-50% faster wit..."
"Canon EOS R50","Is this a good first camera?","<b>Yes, the EOS R50 is Canon's most beginner-friendly mirrorless camera.</b> It's affordable, lightw..."
"Canon EOS R50","Can I use UHS-I cards or do I need UHS-II?","<b>UHS-I V30 cards work perfectly for all R50 recording modes.</b> The camera supports UHS-II for fa..."
"Canon EOS R7","Do I need V60 or is V30 enough for the R7?","<b>V60 is strongly recommended for the EOS R7.</b> While V30 cards may work for some 4K modes, the R..."
"Canon EOS R7","Should I use both SD card slots?","<b>Yes, utilizing both dual UHS-II card slots is recommended, especially for critical shoots.</b> Yo..."
"Canon EOS R10","R10 vs R50 - do I need faster cards?","<b>Yes, the R10 benefits more from V60 cards than the R50 due to its higher performance capabilities..."
"Canon EOS R10","Does the R10 have two SD card slots?","<b>No, the Canon EOS R10 has only one SD card slot.</b> Unlike some professional cameras, there is n..."
"Canon EOS R8","Is the R8 Canon's cheapest full-frame camera?","<b>Yes, the EOS R8 is Canon's most affordable full-frame RF mount camera.</b> It utilizes the same e..."
"Canon EOS R8","Can I use V30 cards in the R8 to save money?","<b>While V30 cards may technically work for some 4K 30fps recording, V60 is explicitly required and ..."
"Canon EOS Rebel T7 (EOS 2000D)","Is this camera still good in 2024?","<b>Yes, for absolute beginners on a tight budget.</b> The Rebel T7 (known as EOS 2000D outside North..."
"Canon EOS Rebel T7 (EOS 2000D)","Do I need expensive fast cards for the Rebel T7?","<b>No, basic Class 10 SD cards are perfectly suitable for the Rebel T7.</b> The camera's 1080p video..."
"Canon PowerShot G7 X Mark III","Why is this camera so popular for YouTube?","<b>The G7 X Mark III features a convenient flip screen, excellent autofocus, and a highly portable, ..."
"Canon PowerShot G7 X Mark III","Can I use the same SD card from my G7 X Mark II?","<b>If your G7 X Mark II card is a V30 speed class, then yes, it will work.</b> However, the Mark III..."
"Canon PowerShot G7 X Mark II","Should I upgrade from the Mark II to the Mark III?","<b>Only if you specifically need 4K video recording or live streaming capabilities.</b> The G7 X Mar..."
"Canon PowerShot G7 X Mark II","Do I need V30 cards for the Mark II?","<b>No, Class 10 (U1) cards are perfectly sufficient for the G7 X Mark II.</b> As this camera's maxim..."
"DJI Mini 4K","How is the DJI Mini 4K different from the Mini 4 Pro?","<b>The Mini 4K is a more budget-oriented version with fewer intelligent flight modes and no obstacle..."
"DJI Mini 4K","Can I use microSD cards larger than 256GB with the Mini 4K?","<b>DJI officially supports and recommends cards up to 256GB for the Mini 4K.</b> While some larger c..."
"DJI Mini 3 (Non-Pro)","Are the SD card requirements for the Mini 3 and Mini 3 Pro the same?","<b>Yes, both the DJI Mini 3 and the DJI Mini 3 Pro require V30 microSD cards.</b> While the Pro vers..."
"Fujifilm X-T5","Do I need V90 cards for the X-T5, or is V60 enough?","<b>V60 cards are sufficient for most users and all typical photography needs on the X-T5.</b> V90 ca..."
"Fujifilm X-T5","Should I use both SD card slots?","<b>Yes, for professional work or any important photography/videography sessions, it is highly recomm..."
"Fujifilm X-M5","Is the Fujifilm X-M5 Fujifilm's cheapest X-mount camera?","<b>Yes, the X-M5 is positioned as Fujifilm's most affordable interchangeable lens camera.</b> It is ..."
"Fujifilm X-T30 II","X-T30 II vs X-T5 - do I need faster cards?","<b>No, the X-T30 II uses a UHS-I card slot and requires V30 cards, which are sufficient for its capa..."
"Fujifilm X-T50","Is the Fujifilm X-T50 essentially the X-T5 in a smaller body?","<b>Essentially, yes.</b> The X-T50 utilizes the same 40MP sensor and image processing engine as the ..."
"Sony FX30","Should I use CFexpress Type A or SD cards in the FX30?","<b>For most common shooting scenarios and high-quality recording, V90 SD cards are perfectly suffici..."
"Sony FX30","Can I mix CFexpress Type A and SD cards in the FX30?","<b>Yes, you can use one CFexpress Type A card and one SD UHS-II card simultaneously.</b> This offers..."
"Sony FX3","Are the SD card recommendations for the FX3 and FX30 the same?","<b>Yes, both the Sony FX3 and FX30 utilize the same dual CFexpress Type A / SD UHS-II slot configura..."
"Sony FX3","Is a V90 SD card truly required for the FX3, or can I use a V60 card?","<b>V60 cards will work for standard 4K recording and many professional codecs, but a V90 speed class..."
"Fujifilm X-E5","What is the key difference between the X-E5 and the X-M5?","<b>The X-E5 is designed with a traditional rangefinder-style body, featuring a centered electronic v..."
"Fujifilm X100V","Are the SD card requirements the same for the X100V and the X100VI?","<b>No, the X100VI requires V60 UHS-II cards for its higher-resolution 6.2K video recording capabilit..."
"Fujifilm X100V","Why is the Fujifilm X100V still so expensive on the used market?","<b>The X100 series experienced a viral surge in popularity on social media platforms, creating immen..."
"Fujifilm X-T3","Is the Fujifilm X-T3 still worth buying used in 2024?","<b>Yes, for budget-conscious enthusiasts and professionals, the X-T3 is still an excellent camera.</..."
"Fujifilm X-T3","Do I really need V90 cards for the X-T3?","<b>You only need V90 cards if you specifically plan to use the 400Mbps ALL-Intra codec for maximum v..."
"Insta360 GO 3","How small is the Insta360 GO 3?","<b>The Insta360 GO 3 is incredibly small and lightweight, weighing only 35 grams and roughly the siz..."
"Insta360 Ace Pro","Insta360 Ace Pro vs GoPro - what about SD cards?","<b>Both the Insta360 Ace Pro and current GoPro Hero models typically require V30 microSD cards for o..."
"Insta360 ONE X2","Insta360 ONE X2 vs X3/X4 - are the card requirements different?","<b>All of Insta360's 360 cameras, including the ONE X2, X3, and X4, require V30 microSD cards for op..."
"Lenovo Legion Go","Legion Go vs ROG Ally - which has better SD card performance?","<b>The ASUS ROG Ally X features a UHS-II card reader, while the Lenovo Legion Go utilizes a UHS-I sl..."
"Lenovo Legion Go","What microSD card capacity do I need for PC games on the Legion Go?","<b>A 512GB card is a good minimum, but 1TB is highly recommended for an extensive library of modern ..."
"Leica Q3","Is the Leica Q3 worth its premium price?","<b>For Leica enthusiasts and professional street photographers, the Q3 is considered a worthwhile in..."
"Leica Q3","Do I really need a V90 SD card for 8K video on the Q3?","<b>Yes, 8K video recording on the Leica Q3 demands a V90 minimum write speed card for stable, uninte..."
"Leica Q3 43","Are the SD card requirements for the Q3 43 and the regular Q3 the same?","<b>Yes, the SD card requirements are identical for both the Leica Q3 43 and the standard Leica Q3.</..."
"Leica M11","Is the Leica M11 worth its considerable price tag?","<b>For Leica purists, professional street photographers, and those who value exceptional craftsmansh..."
"Leica Q2","Should I buy a Leica Q2 or wait for the newer Q3?","<b>The Leica Q3 is the current model, but the Q2 remains an outstanding camera and can often be foun..."
"Leica D-Lux 8","Is the Leica D-Lux 8 effectively a rebadged Panasonic camera?","<b>Yes, the Leica D-Lux series historically shares its platform with Panasonic's Lumix LX series.</b..."
"Leica M10","Is the Leica M10 still worth buying used in 2024?","<b>For photographers seeking the classic Leica rangefinder experience at a more accessible price poi..."
"Panasonic Lumix S9","Lumix S9はブログとコンテンツ制作に適したカメラですか？","<b>はい、Lumix S9はパナソニックの最もコンパクトなフルフレーム カメラとしてコンテンツ クリエイターを対象に設計されています。</b>優れた機内画像安定化、LUT（ルックアップテーブル）の直..."
"Panasonic Lumix S5 IIX","What is the difference in SD card requirements between the S5 IIX and the regular S5 II?","<b>The Lumix S5 IIX specifically requires V90 cards for its advanced internal ProRes and external RA..."
"Panasonic Lumix S5 II","Is the Lumix S5 II good for both photography and video?","<b>Yes, the Lumix S5 II is widely considered one of the best hybrid cameras available, offering a st..."
"Miyoo Mini Plus","What makes the Miyoo Mini Plus so popular?","<b>The Miyoo Mini Plus is incredibly small, affordable, and excels at playing a vast library of retr..."
"Miyoo Mini Plus","How much storage do I need for retro games on the Miyoo Mini Plus?","<b>A 64GB card holds thousands of 8-bit and 16-bit games, while 128GB is generally considered the sw..."
"Nikon D7500","Is the Nikon D7500 still a good camera in 2024?","<b>Yes, for DSLR enthusiasts and sports shooters on a budget, the D7500 remains a very capable camer..."
"Nikon D7500","Should I use both SD card slots on the D7500?","<b>Yes, for important shoots or extended sessions, it is highly recommended to utilize both dual SD ..."
"Nikon Z50 II","Are the SD card requirements for the Z50 II and the original Z50 the same?","<b>Yes, both the Nikon Z50 II and the original Z50 utilize SD UHS-I cards with a V30 minimum speed r..."
"Nikon Z6 III","Should I use CFexpress Type B or SD cards in the Nikon Z6 III?","<b>For most users, high-quality V90 SD cards in both slots are often sufficient for excellent perfor..."
"Nikon Z6 III","Can I mix CFexpress Type B and SD cards in the Z6 III?","<b>Yes, the Nikon Z6 III is designed with a hybrid dual slot: Slot 1 accepts CFexpress Type B, and S..."
"Nikon Z6 II","Is the Nikon Z6 II still a good buy compared to the newer Z6 III?","<b>Yes, if you're on a budget or don't require the absolute latest features, the Z6 II remains an ex..."
"Nikon D850","Is the Nikon D850 still relevant in 2024?","<b>Absolutely, the Nikon D850 remains one of the best and most versatile all-around cameras ever mad..."
"Nikon D850","Do I need XQD cards, or are SD cards enough for the D850?","<b>While SD cards in the second slot work perfectly fine for most users, XQD cards in the primary sl..."
"Nikon D850","Can I use CFexpress cards in the XQD slot of the D850?","<b>No, the D850's XQD slot is specifically designed for XQD cards and is not compatible with CFexpre..."
"Nikon D750","Is the Nikon D750 still worth buying used in 2024?","<b>Yes, for budget-conscious photographers seeking an excellent full-frame DSLR, the D750 remains a ..."
"Nikon D750","Do I need fast SD cards for the Nikon D750?","<b>No, the D750's specifications do not demand high-speed cards like V60 or V90.</b> A Class 10 (U1)..."
"Nikon Z5","Do I need two cards for the Nikon Z5?","<b>It's highly recommended.</b> The Z5's dual UHS-II slots allow you to run a real-time backup, prev..."
"Canon EOS R100","Is the Canon R100 a good first camera?","<b>Yes, it is designed specifically for beginners.</b> It's very affordable and provides a simple en..."
"Anbernic RG35XX Plus / H","Should I replace the SD card that came with my RG35XX?","<b>Yes, immediately.</b> The stock SD cards included with these devices are very low quality and pro..."
"Sony A7R V","Do I need a CFexpress Type A card for the A7R V?","<b>For 8K video and maximum burst shooting performance, yes.</b> For general photography and 4K vide..."
"Nikon D3500","Do I need a fast SD card for the Nikon D3500?","<b>No, you do not.</b> The D3500 is a beginner camera that does not require fast V30 or UHS-II cards..."
"Sony ZV-E10","Can I use a V10 or U1 card in the Sony ZV-E10?","<b>It is not recommended for video.</b> While a U1 card will work for photos, it is too slow for 4K ..."
"Sony a7 III","What is the difference between the two card slots on the Sony a7 III?","<b>Slot 1 supports faster UHS-II cards, while Slot 2 is limited to slower UHS-I speeds.</b> For best..."
"Retroid Pocket 4 / 4 Pro","How big of a microSD card do I need for the Retroid Pocket 4 Pro?","<b>A 128GB or 256GB card is the sweet spot for most users.</b> This provides enough space for thousa..."
"Lenovo Tab M10 Plus (3rd Gen)","Can I set the microSD card as internal storage on the Lenovo Tab M10?","<b>Yes, Android's 'Adoptable Storage' feature allows you to format the microSD card to act as an ext..."
"Sony a6400","Is a V30 card really necessary for the a6400?","<b>Yes, for 4K video.</b> If you plan to shoot in the highest quality 4K XAVC S format, the camera w..."
"Fujifilm X-S10","Can I use the same card for the X-S10 and the X-S20?","<b>Yes. Both cameras have a UHS-I slot and require a V30 card for 4K video.</b> While you can use a ..."
"Canon EOS R6","Are the card requirements for the R6 and R6 Mark II the same?","<b>They are very similar. Both have dual UHS-II slots and benefit from V60/V90 cards.</b> The Mark I..."
"Raspberry Pi 4 Model B","Is a V30 card good for a Raspberry Pi 4?","<b>A V30 rating is not the most important spec. Look for an A1 or A2 rating instead.</b> The V30 rat..."
"Raspberry Pi 4 Model B","What is the minimum recommended capacity for Raspberry Pi 4?","<b>A 32GB card is a good minimum for Raspberry Pi OS with a desktop environment.</b> This leaves eno..."
"Raspberry Pi 3 Model B+","Do I need a fast card for the Raspberry Pi 3?","<b>Yes, a Class 10 card is the minimum you should use.</b> While the Pi 3 is not as fast as a Pi 4 o..."
"Raspberry Pi Zero 2 W","How much storage do I need for a Pi Zero 2 W project?","<b>For most headless projects, a 16GB card is sufficient.</b> It provides enough space for Raspberry..."
"Reolink E1 Pro","How do I install the SD card in the Reolink E1 Pro?","<b>You need to tilt the camera lens all the way up.</b> The microSD card slot is hidden just below t..."
"Orange Pi 5","Do I need a V30 video card for Orange Pi 5?","<b>No, a V30 card is not required for most Orange Pi 5 use cases.</b> The board cares far more about..."
"Orange Pi 5","What capacity microSD card should I choose for Orange Pi 5?","<b>For a typical Linux desktop or server image, 32GB or 64GB is plenty.</b> If you plan to store man..."
"Orange Pi 5","Is microSD slower than NVMe or eMMC on Orange Pi 5?","<b>Yes, microSD is the slowest storage option on the board.</b> It is perfectly fine for experimenti..."
