Device,Question EN,Answer EN (truncated)
"Lenovo Legion Go S","Will a UHS-II microSD card make games load faster on Legion Go S?","<b>No, the reader in the Legion Go S is limited to UHS-I speeds.</b> UHS-II cards fall back to UHS-I..."
"Lenovo Legion Go S","Can I run big open‑world games entirely from the SD card?","<b>Yes, but performance depends heavily on the card you choose.</b> A good A2‑rated V30 card can han..."
"Lenovo Legion Go S","What SD card capacity makes sense for Legion Go S?","<b>512GB is a good minimum, and 1TB is ideal for most players.</b> A handful of current PC games can..."
"GoPro Max 2","Can I reuse my GoPro Hero 11/12/13 cards in the Max 2?","<b>Yes, as long as they are A2 / V30 microSD cards.</b> GoPro now applies essentially the same micro..."
"GoPro Max 2","Is there any benefit to buying a V60 or V90 card for the Max 2?","<b>Not for in-camera recording.</b> The Max 2 is designed around V30-class sustained write speeds. F..."
"GoPro Max 2","How much 8K 360 footage fits on a 256GB card?","Exact runtimes vary with scene complexity and settings, but as a rule of thumb you can expect roughl..."
"Nikon D500","Do I really need CFexpress or XQD for the Nikon D500?","<b>No, but they significantly improve the shooting experience.</b> A good V30 or V60 SD card in the ..."
"Nikon D500","What SD card speed is safe for 4K video on the D500?","<b>Use at least a U3 / V30 card.</b> That guarantees 30 MB/s sustained write performance, which comf..."
"Nikon D500","Can I mix a slow SD card with a fast XQD or CFexpress card?","<b>You can, but it may create a bottleneck in certain recording modes.</b> When you configure the ca..."
"Sony A7R","Can the Sony A7R use UHS-II SD cards?","<b>Yes, but only at UHS-I speeds.</b> The A7R's card slot understands standard SD/SDHC/SDXC media an..."
"Sony A7R","Is a V30 card necessary for the A7R?","<b>No, V30 cards are not required for this camera.</b> The A7R's 1080p recording bitrates are easily..."
"Sony A7R","What SD card capacity is reasonable for the A7R?","<b>Because 36MP RAW files are relatively large, 64GB or 128GB cards strike a good balance.</b> A 32G..."
"Insta360 ONE X3","Does the Insta360 ONE X3 support 1TB microSD cards?","<b>Yes.</b> Insta360 lists 1TB as the maximum supported capacity for the X-series cameras, and their..."
"Insta360 ONE X3","Can I use UHS-II microSD cards in the ONE X3?","<b>They are not recommended.</b> The camera is designed for UHS-I V30 cards, and Insta360 explicitly..."
"Insta360 ONE X3","Will a generic V10 or U1 card work in the ONE X3?","<b>It may work for low-resolution modes, but it is unsafe for 5.7K 360° recording.</b> V10/U1 cards ..."
"Autel EVO II Pro V3","Does the EVO II Pro V3 support 512GB cards?","<b>Autel officially lists 256GB as the maximum supported capacity.</b> While some users report succe..."
"Autel EVO II Pro V3","Why is my 6K video chopping?","<b>This is almost always due to a slow SD card.</b> Recording 6K requires a sustained write speed th..."
"Autel EVO Nano+","What is the max SD card size for Autel Nano+?","<b>The Autel EVO Nano+ supports microSD cards up to 256GB.</b> We recommend UHS-I U3/V30 cards to ha..."
"Autel EVO Lite+","Can I use a 1TB card in the EVO Lite+?","<b>No, the maximum supported capacity is 256GB.</b> Larger cards may not be recognized by the firmwa..."
"Potensic Atom","Why does my Potensic Atom say 'SD Card Error'?","<b>This usually happens if the card is not V30 rated or is formatted incorrectly.</b> Ensure you are..."
"Potensic Atom","What is the difference between Atom and Atom SE card requirements?","<b>Both drones require the same V30 speed class cards.</b> While the Atom has a 3-axis gimbal and th..."
"Potensic Atom SE","Can I use a 64GB card?","<b>Yes, 64GB is a great size for the Atom SE.</b> It will hold several flights worth of 4K footage. ..."
"Skydio 2+","My Skydio won't take off and complains about the SD card?","<b>Skydio drones perform a speed test on the card before flight.</b> If the card is too slow (Class ..."
"Skydio 2+","Does Skydio support UHS-II?","<b>Yes, Skydio 2+ supports UHS-II cards.</b> While not strictly required for recording, UHS-II cards..."
"Skydio X10","Does the Skydio X10 have internal storage?","<b>Yes, typically it has encrypted internal storage, but microSD cards are used for data offload and..."
"FIMI Mini 3","What file system should I use for FIMI Mini 3?","<b>FAT32 is recommended for 32GB cards, and exFAT for 64GB and larger.</b> It is best to format the ..."
"Holy Stone HS175D","Why won't my 128GB card work in the HS175D?","<b>The HS175D only supports cards up to 64GB.</b> Larger cards use the exFAT file system by default,..."
"Holy Stone HS720 / HS720E / HS720G","My HS720 isn't saving photos to the card?","<b>Check the card capacity and format.</b> Ensure the card is no larger than 128GB and is formatted ..."
"Holy Stone HS360S","Does the HS360S require a fast card?","<b>Yes, use a V30 card.</b> Unlike older Holy Stone models, the HS360S records higher bitrate 4K vid..."
"HoverAir X1 Pro","Does the HoverAir X1 Pro have internal storage?","<b>No, the Pro models (Pro and Pro Max) use microSD cards.</b> Only the original standard HoverAir X..."
"HoverAir X1 Pro Max","Do I strictly need a V60 card for the X1 Pro Max?","<b>If you plan to shoot in 8K, yes.</b> For 4K recording, a high-quality V30 card will suffice, but ..."
"HoverAir X1 Pro Max","What happens if I use a slow card in the X1 Pro Max?","The drone may refuse to record in 8K, or automatically downgrade the resolution to 4K to prevent dat..."